{
  "$schema": "https://json-schema.org/draft/2020-12/schema",
  "title": "CanadianCaptive Service Provider",
  "type": "object",
  "required": [
    "id",
    "name",
    "category",
    "description",
    "website",
    "headquarters",
    "verified"
  ],
  "properties": {
    "id": {
      "type": "string",
      "pattern": "^[a-z0-9]+(?:-[a-z0-9]+)*$"
    },
    "name": { "type": "string", "minLength": 1 },
    "category": {
      "type": "string",
      "enum": [
        "Captive Manager",
        "Actuary",
        "Legal Advisor",
        "Auditor & Accountant",
        "Reinsurance Broker",
        "Fronting Carrier"
      ]
    },
    "description": { "type": "string", "minLength": 1 },
    "website": { "type": "string", "format": "uri" },
    "contact_email": { "type": ["string", "null"] },
    "contact_phone": { "type": ["string", "null"] },
    "headquarters": { "type": "string", "minLength": 1 },
    "logo_url": { "type": ["string", "null"] },
    "verified": { "type": "boolean" }
  },
  "additionalProperties": false
}
